car_id,car_name,car_company,car_model,model_year,price,km_covered,mileage,description,customer_review_rating,customer_review_description,years_used
163,"Audi Q5","Audi","Q5",2018,3200000,25000,15,"Luxury SUV with advanced features.",9,"Luxurious interiors. Comfortable ride.",4
164,"Mercedes-Benz GLA","Mercedes-Benz","GLA",2017,2900000,30000,14,"Compact luxury SUV with modern features.",8.5,"Modern features. Comfortable ride.",5
165,"Toyota Yaris","Toyota","Yaris",2019,1100000,20000,17,"Premium sedan with stylish design.",8,"Stylish design. Comfortable ride.",3
166,"Maruti Suzuki Baleno","Maruti Suzuki","Baleno",2018,750000,28000,16,"Premium hatchback with modern features.",8.5,"Modern features. Spacious cabin.",4
167,"Hyundai Venue","Hyundai","Venue",2020,900000,18000,18,"Stylish compact SUV with modern features.",8,"Stylish design. Comfortable interiors.",2
168,"Ford Aspire","Ford","Aspire",2019,800000,22000,19,"Compact sedan with good performance.",8,"Good performance. Comfortable ride.",2
169,"Mahindra Marazzo","Mahindra","Marazzo",2020,1300000,15000,20,"Spacious MPV with modern features.",8.5,"Spacious interiors. Comfortable ride.",1
170,"Tata Tigor","Tata","Tigor",2018,800000,25000,16,"Stylish compact sedan with good features.",8,"Stylish design. Feature-packed.",4
171,"Volkswagen Tiguan","Volkswagen","Tiguan",2016,2400000,38000,13,"Premium SUV with modern features.",8.5,"Modern features. Comfortable ride.",6
172,"Honda Civic","Honda","Civic",2018,1200000,32000,14,"Elegant sedan with advanced features.",8.5,"Elegant design. Comfortable ride.",5
173,"Toyota Innova","Toyota","Innova",2019,1500000,20000,18,"Spacious MPV with comfortable seating.",8.5,"Comfortable ride. Spacious cabin.",3
174,"Maruti Suzuki Ciaz","Maruti Suzuki","Ciaz",2017,850000,30000,15,"Premium sedan with spacious cabin.",8.5,"Spacious cabin. Comfortable ride.",4
175,"Hyundai Grand i10","Hyundai","Grand i10",2016,600000,35000,17,"Feature-packed hatchback with modern design.",8,"Modern design. Practical features.",5
176,"Ford Mustang","Ford","Mustang",2017,3200000,18000,20,"Iconic muscle car with powerful performance.",9,"Powerful performance. Bold design.",2
177,"Mahindra Bolero","Mahindra","Bolero",2016,1100000,40000,14,"Sturdy and reliable SUV with rugged design.",8,"Rugged design. Reliable performance.",5
178,"Tata Safari","Tata","Safari",2018,1700000,35000,15,"Classic SUV with modern features.",8.5,"Modern features. Solid build quality.",3
179,"Volkswagen T-Roc","Volkswagen","T-Roc",2019,2100000,22000,19,"Stylish and compact SUV with premium features.",8.5,"Stylish design. Comfortable interiors.",2
180,"Renault Triber","Renault","Triber",2020,800000,20000,18,"Versatile MPV with modular seating.",8,"Modular seating. Good value for money.",1
181,"Chevrolet Trailblazer","Chevrolet","Trailblazer",2018,2400000,25000,14,"Rugged SUV with powerful engine options.",8,"Powerful performance. Spacious cabin.",4
182,"Nissan Kicks","Nissan","Kicks",2019,1000000,18000,20,"Stylish and feature-packed SUV with modern design.",8.5,"Modern design. Comfortable interiors.",3
183,"Skoda Karoq","Skoda","Karoq",2018,2600000,30000,13,"Premium SUV with luxurious interiors.",9,"Luxurious interiors. Comfortable ride.",5
184,"BMW X3","BMW","X3",2019,4200000,18000,17,"Luxurious SUV with advanced technology.",9,"Luxurious interiors. Strong performance.",2
185,"Audi Q3","Audi","Q3",2018,3200000,22000,16,"Compact luxury SUV with elegant design.",8.5,"Elegant design. Comfortable ride.",3
186,"Mercedes-Benz GLE","Mercedes-Benz","GLE",2017,3800000,28000,15,"Luxurious SUV with premium features.",9,"Luxurious interiors. Smooth ride quality.",4
187,"Toyota Camry","Toyota","Camry",2018,3500000,30000,14,"Premium sedan with refined performance.",8.5,"Smooth driving experience. Comfortable interiors.",5
188,"Maruti Suzuki Wagon R","Maruti Suzuki","Wagon R",2019,550000,20000,19,"Spacious and practical hatchback with good fuel efficiency.",7.5,"Practical features. Easy to drive.",6
189,"Hyundai Aura","Hyundai","Aura",2020,750000,18000,18,"Stylish and feature-packed compact sedan.",8,"Feature-packed. Stylish design.",4
190,"Ford Freestyle","Ford","Freestyle",2019,700000,25000,17,"Crossover with rugged styling and good ground clearance.",8,"Rugged styling. Practical features.",3
191,"Mahindra KUV100 NXT","Mahindra","KUV100 NXT",2018,600000,30000,16,"Compact SUV with unique styling.",7.5,"Unique design. Comfortable ride.",5
192,"Tata Altroz","Tata","Altroz",2019,800000,22000,18,"Premium hatchback with modern features.",8,"Modern features. Sleek design.",4
193,"Volkswagen Ameo","Volkswagen","Ameo",2018,750000,25000,17,"Compact sedan with solid build quality.",8,"Solid build quality. Peppy engine.",5
194,"Renault Lodgy","Renault","Lodgy",2016,950000,28000,15,"Spacious and practical MPV with versatile seating.",8.5,"Versatile seating. Spacious interiors.",3
195,"Chevrolet Enjoy","Chevrolet","Enjoy",2017,850000,30000,16,"Practical MPV with spacious cabin.",7.5,"Spacious interiors. Practical features.",4
196,"Nissan Micra Active","Nissan","Micra Active",2016,350000,35000,20,"Affordable hatchback with decent features.",7,"Affordable pricing. Decent performance.",6
197,"Skoda Fabia","Skoda","Fabia",2019,800000,22000,18,"Premium hatchback with solid build quality and comfortable interiors.",8,"Solid build quality. Comfortable ride.",5
198,"BMW X5","BMW","X5",2020,5500000,20000,22,"Luxurious SUV with advanced features and strong performance.",9,"Luxurious interiors. Powerful engine.",2
199,"Audi A6","Audi","A6",2018,4200000,25000,17,"Executive sedan with refined performance and elegant design.",8.5,"Smooth acceleration. Elegant interiors.",3
200,"Mercedes-Benz GLC","Mercedes-Benz","GLC",2019,4500000,18000,20,"Luxurious SUV with premium features and elegant design.",9,"Luxurious interiors. Smooth ride quality.",2
